{
  "schema_version": 1,
  "kind": "toolgraph.control-preflight",
  "run_id": "run-control-1",
  "created_at": "2026-08-11T00:00:00+00:00",
  "mode": "advisory",
  "profile": "review",
  "plan_digest": "sha256:bf7c56917ab347e0c86cd06de284bf655fb539940c4ab50cd2849a308d9a9d7f",
  "graph_state": {
    "instance_id": "test-instance",
    "generation": 42
  },
  "decision": "advisory_allow",
  "evaluations": [
    {
      "principal": "codex",
      "agent_found": true,
      "eligible": ["workspace::read", "workspace::write"],
      "rejected": []
    },
    {
      "principal": "claude",
      "agent_found": true,
      "eligible": ["workspace::read", "workspace::write"],
      "rejected": []
    }
  ],
  "findings": []
}
